{
  "event_id": "e69e1dd3-7204-51d2-9768-36cf5ede789a",
  "schema_version": "confenge.delivery_order_requested.v1",
  "synthetic": true,
  "correlation_id": "corr-synthetic-cfg-diag-exp-001",
  "causation_id": "fixture-financial-gate-cfg-diag-exp-001",
  "idempotency_key": "delivery-order:sha256:e1e93bd326036d3a399193c9e9492ffd6351c378c6866fda23e9e229f6493c76",
  "organization_id": "11111111-1111-4111-8111-000000000047",
  "account_id": "account-synthetic-cfg-diag-exp-001",
  "client_ref": "client:redacted:cfg-diag-exp-001",
  "opportunity_id": "opportunity-synthetic-cfg-diag-exp-001",
  "qco_id": "qco-synthetic-cfg-diag-exp-001",
  "proposal_id": "220f817a-5b2b-5799-b403-2ce8c731e4bf",
  "proposal_version": 1,
  "accepted_snapshot_hash": "sha256:7cbe3a5d5663e4ae15001e56f97b852287c94eea2836e200c3a5a309bc73f2bd",
  "offer_id": "CFG-DIAG-EXP-v1",
  "offer_version": "v1",
  "deliverable_id": "CFG-DIAG-EXP-v1",
  "deliverable_version": "v1",
  "scope_version": "CFG-SCOPE-DIAG-EXP-v1",
  "price_version": "CFG-OFFER-CATALOG-v1",
  "terms_version": "CFG-TERMS-B2B-2026-08-17-v1",
  "financial_gate": {
    "schema_version": "confenge.financial_gate.v1",
    "state": "SYNTHETIC_VALID",
    "synthetic": true,
    "source_event_id": "fixture-financial-gate-cfg-diag-exp-001",
    "received_revenue": false,
    "evidence_refs": [
      "fixture:financial-gate:synthetic-valid"
    ]
  },
  "onboarding_ref": "onboarding:synthetic:cfg-diag-exp-001",
  "occurred_at": "2026-08-25T12:05:00Z",
  "evidence_refs": [
    "evidence:synthetic:ACCEPTED",
    "evidence:synthetic:APPROVED_TO_SEND",
    "evidence:synthetic:PREPARED",
    "evidence:synthetic:SENT",
    "fixture:cfg-diag-exp-v1:proposal",
    "fixture:financial-gate:synthetic-valid"
  ]
}
